{
  "artifactVerification": {
    "verifiedBoardCount": 27,
    "verifiedCellCount": 405
  },
  "calibrationProfileSetSha256": "1536fa9255d14d5b8710c436221c030065f7a99bbaa663888da30eaa270d4b55",
  "calibrationProfileSetVersion": "grid-calibration-profiles-v1",
  "cropReportSha256": "e652ef9bf4e84c2b85a80b95d2715e75109151317c59f41b5442b90847df6569",
  "cropperVersion": "board-cell-crops-v2-calibrated-v1",
  "fullCorpus": {
    "boardCount": 387,
    "cellCount": 5805,
    "imageCount": 43
  },
  "goldenAcceptedEntryCount": 27,
  "goldenSha256": "6bbfba58046009f512a7ce2ff0b10bc160f94c358754b96e55ce620ae6c298fd",
  "goldenVersion": "cell-grid-golden-v1",
  "lineErrorBudgetP95Px": 5.0,
  "lineErrors": [
    {
      "absoluteErrorPx": 0.6014,
      "axis": "vertical",
      "boardPosition": 0,
      "endpointAbsoluteErrorsPx": [
        0.4766,
        0.7261
      ],
      "expectedCoordinate": 100.0,
      "lineIndex": 0,
      "observationId": "1b940b5bb7bdee1ac0f6e120981005643d4b53d3d2e40a678c9d7c4bec3538b3",
      "projectedEndpoints": [
        {
          "x": 100.4766,
          "y": 0.4349
        },
        {
          "x": 99.2739,
          "y": 298.9885
        }
      ],
      "sequenceNumber": 1,
      "sourceGroup": "blazing-hot-7-deluxe-session-1",
      "v2Coordinate": 100.0
    },
    {
      "absoluteErrorPx": 0.497,
      "axis": "vertical",
      "boardPosition": 0,
      "endpointAbsoluteErrorsPx": [
        0.0598,
        0.9341
      ],
      "expectedCoordinate": 200.0,
      "lineIndex": 1,
      "observationId": "1b940b5bb7bdee1ac0f6e120981005643d4b53d3d2e40a678c9d7c4bec3538b3",
      "projectedEndpoints": [
        {
          "x": 200.0598,
          "y": 0.2236
        },
        {
          "x": 199.0659,
          "y": 299.0051
        }
      ],
      "sequenceNumber": 1,
      "sourceGroup": "blazing-hot-7-deluxe-session-1",
      "v2Coordinate": 200.0
    },
    {
      "absoluteErrorPx": 0.5971,
      "axis": "vertical",
      "boardPosition": 0,
      "endpointAbsoluteErrorsPx": [
        0.2049,
        0.9893
      ],
      "expectedCoordinate": 300.0,
      "lineIndex": 2,
      "observationId": "1b940b5bb7bdee1ac0f6e120981005643d4b53d3d2e40a678c9d7c4bec3538b3",
      "projectedEndpoints": [
        {
          "x": 299.7951,
          "y": 0.012
        },
        {
          "x": 299.0107,
          "y": 299.0217
        }
      ],
      "sequenceNumber": 1,
      "sourceGroup": "blazing-hot-7-deluxe-session-1",
      "v2Coordinate": 300.0
    },
    {
      "absoluteErrorPx": 0.6043,
      "axis": "vertical",
      "boardPosition": 0,
      "endpointAbsoluteErrorsPx": [
        0.3171,
        0.8915
      ],
      "expectedCoordinate": 400.0,
      "lineIndex": 3,
      "observationId": "1b940b5bb7bdee1ac0f6e120981005643d4b53d3d2e40a678c9d7c4bec3538b3",
      "projectedEndpoints": [
        {
          "x": 399.6829,
          "y": -0.1999
        },
        {
          "x": 399.1085,
          "y": 299.0383
        }
      ],
      "sequenceNumber": 1,
      "sourceGroup": "blazing-hot-7-deluxe-session-1",
      "v2Coordinate": 400.0
    },
    {
      "absoluteErrorPx": 0.3381,
      "axis": "horizontal",
      "boardPosition": 0,
      "endpointAbsoluteErrorsPx": [
        0.2811,
        0.3951
      ],
      "expectedCoordinate": 100.0,
      "lineIndex": 0,
      "observationId": "1b940b5bb7bdee1ac0f6e120981005643d4b53d3d2e40a678c9d7c4bec3538b3",
      "projectedEndpoints": [
        {
          "x": 0.5739,
          "y": 100.2811
        },
        {
          "x": 498.6002,
          "y": 99.6049
        }
      ],
      "sequenceNumber": 1,
      "sourceGroup": "blazing-hot-7-deluxe-session-1",
      "v2Coordinate": 100.0
    },
    {
      "absoluteErrorPx": 0.1477,
      "axis": "horizontal",
      "boardPosition": 0,
      "endpointAbsoluteErrorsPx": [
        0.0563,
        0.239
      ],
      "expectedCoordinate": 200.0,
      "lineIndex": 1,
      "observationId": "1b940b5bb7bdee1ac0f6e120981005643d4b53d3d2e40a678c9d7c4bec3538b3",
      "projectedEndpoints": [
        {
          "x": 0.102,
          "y": 200.0563
        },
        {
          "x": 498.4778,
          "y": 199.761
        }
      ],
      "sequenceNumber": 1,
      "sourceGroup": "blazing-hot-7-deluxe-session-1",
      "v2Coordinate": 200.0
    },
    {
      "absoluteErrorPx": 0.7837,
      "axis": "vertical",
      "boardPosition": 6,
      "endpointAbsoluteErrorsPx": [
        0.997,
        0.5704
      ],
      "expectedCoordinate": 100.0,
      "lineIndex": 0,
      "observationId": "dbfeed20175283e40da3cd8a1921a215d69054262f93430fa45c63c8ec25419f",
      "projectedEndpoints": [
        {
          "x": 99.003,
          "y": 1.5873
        },
        {
          "x": 99.4296,
          "y": 299.3649
        }
      ],
      "sequenceNumber": 16,
      "sourceGroup": "blazing-hot-7-deluxe-session-1",
      "v2Coordinate": 100.0
    },
    {
      "absoluteErrorPx": 0.6032,
      "axis": "vertical",
      "boardPosition": 6,
      "endpointAbsoluteErrorsPx": [
        0.8066,
        0.3999
      ],
      "expectedCoordinate": 200.0,
      "lineIndex": 1,
      "observationId": "dbfeed20175283e40da3cd8a1921a215d69054262f93430fa45c63c8ec25419f",
      "projectedEndpoints": [
        {
          "x": 199.1934,
          "y": 1.3187
        },
        {
          "x": 199.6001,
          "y": 299.179
        }
      ],
      "sequenceNumber": 16,
      "sourceGroup": "blazing-hot-7-deluxe-session-1",
      "v2Coordinate": 200.0
    },
    {
      "absoluteErrorPx": 0.367,
      "axis": "vertical",
      "boardPosition": 6,
      "endpointAbsoluteErrorsPx": [
        0.5605,
        0.1736
      ],
      "expectedCoordinate": 300.0,
      "lineIndex": 2,
      "observationId": "dbfeed20175283e40da3cd8a1921a215d69054262f93430fa45c63c8ec25419f",
      "projectedEndpoints": [
        {
          "x": 299.4395,
          "y": 1.0499
        },
        {
          "x": 299.8264,
          "y": 298.9931
        }
      ],
      "sequenceNumber": 16,
      "sourceGroup": "blazing-hot-7-deluxe-session-1",
      "v2Coordinate": 300.0
    },
    {
      "absoluteErrorPx": 0.1835,
      "axis": "vertical",
      "boardPosition": 6,
      "endpointAbsoluteErrorsPx": [
        0.2586,
        0.1083
      ],
      "expectedCoordinate": 400.0,
      "lineIndex": 3,
      "observationId": "dbfeed20175283e40da3cd8a1921a215d69054262f93430fa45c63c8ec25419f",
      "projectedEndpoints": [
        {
          "x": 399.7414,
          "y": 0.7809
        },
        {
          "x": 400.1083,
          "y": 298.8071
        }
      ],
      "sequenceNumber": 16,
      "sourceGroup": "blazing-hot-7-deluxe-session-1",
      "v2Coordinate": 400.0
    },
    {
      "absoluteErrorPx": 0.8311,
      "axis": "horizontal",
      "boardPosition": 6,
      "endpointAbsoluteErrorsPx": [
        1.4325,
        0.2296
      ],
      "expectedCoordinate": 100.0,
      "lineIndex": 0,
      "observationId": "dbfeed20175283e40da3cd8a1921a215d69054262f93430fa45c63c8ec25419f",
      "projectedEndpoints": [
        {
          "x": -0.9824,
          "y": 101.4325
        },
        {
          "x": 499.2114,
          "y": 100.2296
        }
      ],
      "sequenceNumber": 16,
      "sourceGroup": "blazing-hot-7-deluxe-session-1",
      "v2Coordinate": 100.0
    },
    {
      "absoluteErrorPx": 0.5323,
      "axis": "horizontal",
      "boardPosition": 6,
      "endpointAbsoluteErrorsPx": [
        0.9959,
        0.0687
      ],
      "expectedCoordinate": 200.0,
      "lineIndex": 1,
      "observationId": "dbfeed20175283e40da3cd8a1921a215d69054262f93430fa45c63c8ec25419f",
      "projectedEndpoints": [
        {
          "x": -0.833,
          "y": 200.9959
        },
        {
          "x": 499.3275,
          "y": 199.9313
        }
      ],
      "sequenceNumber": 16,
      "sourceGroup": "blazing-hot-7-deluxe-session-1",
      "v2Coordinate": 200.0
    },
    {
      "absoluteErrorPx": 0.4179,
      "axis": "vertical",
      "boardPosition": 8,
      "endpointAbsoluteErrorsPx": [
        0.3239,
        0.5118
      ],
      "expectedCoordinate": 100.0,
      "lineIndex": 0,
      "observationId": "e1377e290ada9bdd53ceadf97ac03e26e68ee5fd07fbdf5bf3dedf9bf62daf21",
      "projectedEndpoints": [
        {
          "x": 100.3239,
          "y": 1.2328
        },
        {
          "x": 99.4882,
          "y": 298.2382
        }
      ],
      "sequenceNumber": 27,
      "sourceGroup": "blazing-hot-7-deluxe-session-1",
      "v2Coordinate": 100.0
    },
    {
      "absoluteErrorPx": 0.5622,
      "axis": "vertical",
      "boardPosition": 8,
      "endpointAbsoluteErrorsPx": [
        0.1307,
        0.9937
      ],
      "expectedCoordinate": 200.0,
      "lineIndex": 1,
      "observationId": "e1377e290ada9bdd53ceadf97ac03e26e68ee5fd07fbdf5bf3dedf9bf62daf21",
      "projectedEndpoints": [
        {
          "x": 200.1307,
          "y": 1.1742
        },
        {
          "x": 199.0063,
          "y": 298.5203
        }
      ],
      "sequenceNumber": 27,
      "sourceGroup": "blazing-hot-7-deluxe-session-1",
      "v2Coordinate": 200.0
    },
    {
      "absoluteErrorPx": 0.7072,
      "axis": "vertical",
      "boardPosition": 8,
      "endpointAbsoluteErrorsPx": [
        0.1674,
        1.247
      ],
      "expectedCoordinate": 300.0,
      "lineIndex": 2,
      "observationId": "e1377e290ada9bdd53ceadf97ac03e26e68ee5fd07fbdf5bf3dedf9bf62daf21",
      "projectedEndpoints": [
        {
          "x": 300.1674,
          "y": 1.1154
        },
        {
          "x": 298.753,
          "y": 298.8031
        }
      ],
      "sequenceNumber": 27,
      "sourceGroup": "blazing-hot-7-deluxe-session-1",
      "v2Coordinate": 300.0
    },
    {
      "absoluteErrorPx": 0.8529,
      "axis": "vertical",
      "boardPosition": 8,
      "endpointAbsoluteErrorsPx": [
        0.4347,
        1.2711
      ],